{
  "schema_version": 1,
  "id": "T-0002",
  "created_at": "2026-10-22T04:32:26.201Z",
  "target": {
    "repo": "example/ts-mini",
    "profile": "/tmp/sf-old-homes/v0.7.0/profile.yaml",
    "base_branch": "main"
  },
  "source": {
    "kind": "manual",
    "admitted_by": "operator",
    "snapshot_digest": "sha256:d4b21894aa38e92d367994865b0b6fa0131130270aa8cdb768d42f6695b8af49"
  },
  "text_trust": "operator",
  "title": "Cancelled before it ran",
  "priority": "normal"
}
